<?xml version="1.0" encoding="UTF-8"?>
<list xmlns:xsi="http://www.w3.org/2001/XMLSchema-instance" xsi:noNamespaceSchemaLocation="xsd/L2HubHuntSpots.xsd">
	<!-- L2Hub: споты охотников-фантомов — группы спавна мобов с узким разбросом уровней и кластеры мобов-точек. Сгенерировано tools/fake_players.py. -->
	<spot level="1" min="1" max="3" region="DarkElfTerritory" name="Dark Elf Starting · восток" x="26135" y="13674" z="-3704" radius="1500" mobs="10" />
	<spot level="1" min="1" max="2" region="DarkElfTerritory" name="Dark Elf Starting · восток" x="24496" y="9207" z="-3584" radius="1500" mobs="8" />
	<spot level="1" min="1" max="2" region="DarkElfTerritory" name="Dark Elf Starting · восток" x="25308" y="13254" z="-3648" radius="1500" mobs="8" />
	<spot level="1" min="1" max="4" region="TalkingIsland" name="Keltir" x="-85796" y="252746" z="-3672" radius="1500" mobs="18" />
	<spot level="1" min="1" max="3" region="TalkingIsland" name="Talking Island Monsters · Talking Island Village" x="-81412" y="246563" z="-3680" radius="1500" mobs="20" />
	<spot level="1" min="1" max="1" region="TalkingIsland" name="Talking Island Monsters · юго-восток" x="-74384" y="254368" z="-3288" radius="1500" mobs="19" />
	<spot level="2" min="1" max="3" region="DarkElfTerritory" name="Dark Elf Starting · восток" x="22786" y="15011" z="-3640" radius="1500" mobs="12" />
	<spot level="2" min="1" max="3" region="ElvenTerritory" name="Elven Starting · северо-восток" x="48167" y="42987" z="-3496" radius="507" mobs="11" />
	<spot level="2" min="1" max="4" region="ElvenTerritory" name="Elven Starting · северо-восток" x="52380" y="41259" z="-3472" radius="493" mobs="10" />
	<spot level="2" min="1" max="3" region="ElvenTerritory" name="Elven Starting · северо-восток" x="41277" y="38957" z="-3496" radius="400" mobs="9" />
	<spot level="2" min="1" max="3" region="ElvenTerritory" name="Elven Starting · северо-восток" x="41672" y="41508" z="-3488" radius="459" mobs="9" />
	<spot level="2" min="1" max="3" region="ElvenTerritory" name="Elven Starting · северо-восток" x="43955" y="43474" z="-3608" radius="1500" mobs="8" />
	<spot level="2" min="2" max="3" region="ElvenTerritory" name="Elven Starting · северо-восток" x="43854" y="37353" z="-3512" radius="400" mobs="8" />
	<spot level="2" min="2" max="3" region="ElvenTerritory" name="Elven Starting · северо-восток" x="47937" y="37497" z="-3552" radius="400" mobs="8" />
	<spot level="2" min="1" max="3" region="OrcTerritory" name="Orc Starting · Orc Village" x="-49644" y="-110570" z="-240" radius="1500" mobs="20" />
	<spot level="2" min="1" max="3" region="OrcTerritory" name="Orc Starting · Orc Village" x="-49366" y="-115720" z="-160" radius="1500" mobs="16" />
	<spot level="3" min="2" max="5" region="DarkElfTerritory" name="Dark Elf Starting · восток" x="26534" y="18263" z="-3496" radius="1500" mobs="12" />
	<spot level="3" min="2" max="3" region="DwarvenTerritory" name="Dwarven Starting · Dwarven Village" x="116477" y="-174172" z="-880" radius="1500" mobs="13" />
	<spot level="3" min="3" max="4" region="ElvenTerritory" name="Elven Starting · северо-восток" x="38195" y="38683" z="-3600" radius="1500" mobs="8" />
	<spot level="3" min="1" max="4" region="TalkingIsland" name="Talking Island Monsters · Talking Island Village" x="-90170" y="241150" z="-3544" radius="1500" mobs="8" />
	<spot level="4" min="4" max="5" region="ElvenTerritory" name="Elven Starting · Elven Village" x="48769" y="55824" z="-3504" radius="400" mobs="8" />
	<spot level="4" min="3" max="4" region="ElvenTerritory" name="Elven Starting · северо-восток" x="39676" y="35960" z="-3608" radius="1500" mobs="8" />
	<spot level="4" min="3" max="4" region="ElvenTerritory" name="Elven Starting · северо-восток" x="38941" y="41808" z="-3592" radius="400" mobs="8" />
	<spot level="4" min="4" max="5" region="ElvenTerritory" name="Elven Starting · юго-восток" x="39663" y="54854" z="-3416" radius="1500" mobs="9" />
	<spot level="4" min="3" max="4" region="OrcTerritory" name="Orc Starting · Orc Village" x="-46277" y="-118995" z="-240" radius="1500" mobs="8" />
	<spot level="5" min="4" max="6" region="DarkElfTerritory" name="Dark Elf Starting · восток" x="30648" y="14201" z="-3696" radius="1500" mobs="10" />
	<spot level="5" min="4" max="7" region="DarkElfTerritory" name="Dark Elf Starting · северо-восток" x="19946" y="6931" z="-3520" radius="1500" mobs="12" />
	<spot level="5" min="4" max="7" region="DarkElfTerritory" name="Dark Elf Starting · юго-восток" x="23026" y="20175" z="-3424" radius="1500" mobs="12" />
	<spot level="5" min="4" max="6" region="DwarvenTerritory" name="Dwarven Starting · юго-запад" x="119350" y="-186196" z="-3240" radius="1500" mobs="8" />
	<spot level="5" min="4" max="5" region="ElvenTerritory" name="Elven Starting · Elven Village" x="50556" y="46156" z="-3480" radius="1500" mobs="11" />
	<spot level="5" min="4" max="6" region="ElvenTerritory" name="Elven Starting · восток" x="53829" y="45731" z="-3544" radius="1500" mobs="11" />
	<spot level="5" min="4" max="6" region="ElvenTerritory" name="Elven Starting · юго-восток" x="50985" y="59540" z="-3400" radius="1500" mobs="9" />
	<spot level="5" min="4" max="7" region="OrcTerritory" name="Orc Starting · Orc Village" x="-41924" y="-109084" z="-1752" radius="1500" mobs="8" />
	<spot level="5" min="4" max="6" region="OrcTerritory" name="Orc Starting · запад" x="-39501" y="-109525" z="-1800" radius="1500" mobs="15" />
	<spot level="5" min="4" max="6" region="OrcTerritory" name="Orc Starting · запад" x="-40459" y="-117988" z="-1920" radius="1500" mobs="11" />
	<spot level="5" min="4" max="6" region="OrcTerritory" name="Orc Starting · северо-запад" x="-38227" y="-121504" z="-1672" radius="1500" mobs="11" />
	<spot level="5" min="4" max="6" region="TalkingIsland" name="Talking Island Monsters · Obelisk of Victory" x="-93021" y="240230" z="-3416" radius="1500" mobs="10" />
	<spot level="5" min="4" max="6" region="TalkingIsland" name="Talking Island Monsters · Obelisk of Victory" x="-94200" y="243516" z="-3560" radius="1500" mobs="8" />
	<spot level="5" min="5" max="5" region="TalkingIsland" name="Talking Island Monsters · юго-восток" x="-95466" y="246266" z="-3624" radius="1500" mobs="17" />
	<spot level="6" min="5" max="7" region="DarkElfTerritory" name="Dark Elf Starting · восток" x="29993" y="18218" z="-3720" radius="1500" mobs="10" />
	<spot level="6" min="5" max="7" region="DarkElfTerritory" name="Dark Elf Starting · восток" x="29788" y="7490" z="-3720" radius="1500" mobs="10" />
	<spot level="6" min="4" max="7" region="DarkElfTerritory" name="Dark Elf Starting · северо-восток" x="25165" y="5511" z="-3616" radius="1500" mobs="11" />
	<spot level="6" min="5" max="7" region="ElvenTerritory" name="Elven Starting · Elven Village" x="51707" y="50504" z="-3520" radius="1500" mobs="12" />
	<spot level="6" min="5" max="7" region="ElvenTerritory" name="Elven Starting · восток" x="54347" y="50891" z="-3576" radius="1500" mobs="10" />
	<spot level="6" min="5" max="6" region="OrcTerritory" name="Orc Starting · запад" x="-37520" y="-117467" z="-1664" radius="1500" mobs="11" />
	<spot level="6" min="6" max="7" region="OrcTerritory" name="Orc Starting · запад" x="-41526" y="-103092" z="-2768" radius="1500" mobs="9" />
	<spot level="6" min="4" max="7" region="TalkingIsland" name="Talking Island Monsters · Obelisk of Victory" x="-96861" y="242819" z="-3504" radius="1500" mobs="10" />
	<spot level="6" min="4" max="7" region="TalkingIsland" name="Talking Island Monsters · Obelisk of Victory" x="-96232" y="239708" z="-3272" radius="1500" mobs="10" />
	<spot level="6" min="4" max="7" region="TalkingIsland" name="Talking Island Monsters · Obelisk of Victory" x="-93502" y="236665" z="-3640" radius="1500" mobs="10" />
	<spot level="7" min="6" max="7" region="DwarvenTerritory" name="Dwarven Starting · юго-запад" x="125159" y="-177241" z="-1304" radius="1500" mobs="11" />
	<spot level="8" min="8" max="10" region="DarkElfTerritory" name="Dark Elf Starting · запад" x="-10925" y="20374" z="-3704" radius="1500" mobs="24" />
	<spot level="8" min="8" max="9" region="DarkElfTerritory" name="Dark Elf Starting · запад" x="-10417" y="15410" z="-3608" radius="1500" mobs="14" />
	<spot level="8" min="8" max="9" region="DwarvenTerritory" name="Dwarven Starting · запад" x="121834" y="-198524" z="-3680" radius="1500" mobs="9" />
	<spot level="8" min="8" max="9" region="DwarvenTerritory" name="Dwarven Starting · запад" x="120349" y="-192969" z="-3472" radius="1500" mobs="8" />
	<spot level="8" min="8" max="9" region="DwarvenTerritory" name="Dwarven Starting · запад" x="117458" y="-197595" z="-3688" radius="1500" mobs="8" />
	<spot level="8" min="7" max="8" region="ElvenTerritory" name="Elven Starting · восток" x="38324" y="50214" z="-3512" radius="1500" mobs="14" />
	<spot level="8" min="7" max="8" region="ElvenTerritory" name="Elven Starting · юго-восток" x="44389" y="61465" z="-3456" radius="1500" mobs="16" />
	<spot level="8" min="7" max="8" region="OrcTerritory" name="Orc Starting · северо-запад" x="-28767" y="-124609" z="-2208" radius="1500" mobs="10" />
	<spot level="8" min="7" max="9" region="TalkingIsland" name="Talking Island Monsters · Obelisk of Victory" x="-96627" y="233941" z="-3624" radius="1500" mobs="11" />
	<spot level="9" min="8" max="9" region="DarkElfTerritory" name="Dark Elf Starting · запад" x="-8287" y="11650" z="-2952" radius="1500" mobs="15" />
	<spot level="9" min="8" max="10" region="DarkElfTerritory" name="Dark Elf Starting · запад" x="-13666" y="7232" z="-3512" radius="1500" mobs="10" />
	<spot level="9" min="8" max="9" region="DarkElfTerritory" name="Dark Elf Starting · юго-запад" x="-8648" y="23923" z="-3480" radius="1500" mobs="13" />
	<spot level="9" min="7" max="10" region="ElvenTerritory" name="Elven Starting · восток" x="34769" y="51063" z="-3560" radius="1500" mobs="12" />